{
  "$schema": "https://json-schema.org/draft/2020-12/schema",
  "$id": "https://example.com/schemas/board-ai-roadmap-schema-v1.json",
  "title": "Board AI Roadmap Schema v1",
  "type": "object",
  "required": [
    "schema_version",
    "program",
    "financials",
    "domains",
    "jurisdictions",
    "stage_gates"
  ],
  "properties": {
    "schema_version": {
      "type": "string",
      "const": "board-ai-roadmap-v1"
    },
    "program": {
      "type": "object",
      "required": [
        "name",
        "period",
        "investment_usd_billion",
        "value_target_usd_billion",
        "irr_hurdle_percent",
        "discount_rate_percent"
      ],
      "properties": {
        "name": {"type": "string", "minLength": 1},
        "period": {"type": "string", "pattern": "^\\d{4}-\\d{4}$"},
        "investment_usd_billion": {"type": "number", "minimum": 0},
        "value_target_usd_billion": {"type": "number", "minimum": 0},
        "irr_hurdle_percent": {"type": "number", "minimum": 0},
        "discount_rate_percent": {"type": "number", "minimum": 0}
      },
      "additionalProperties": false
    },
    "financials": {
      "type": "object",
      "required": [
        "illustrative_net_cash_flows_usd_billion",
        "npv_usd_billion",
        "payback_years"
      ],
      "properties": {
        "illustrative_net_cash_flows_usd_billion": {
          "type": "object",
          "required": ["2026", "2027", "2028", "2029", "2030"],
          "additionalProperties": false,
          "properties": {
            "2026": {"type": "number"},
            "2027": {"type": "number"},
            "2028": {"type": "number"},
            "2029": {"type": "number"},
            "2030": {"type": "number"}
          }
        },
        "npv_usd_billion": {"type": "number"},
        "payback_years": {"type": "number", "minimum": 0}
      },
      "additionalProperties": false
    },
    "domains": {
      "type": "array",
      "minItems": 1,
      "items": {"type": "string", "minLength": 1}
    },
    "jurisdictions": {
      "type": "object",
      "required": ["US", "EU", "UK", "APAC"],
      "additionalProperties": false,
      "properties": {
        "US": {"$ref": "#/$defs/nonEmptyStringArray"},
        "EU": {"$ref": "#/$defs/nonEmptyStringArray"},
        "UK": {"$ref": "#/$defs/nonEmptyStringArray"},
        "APAC": {"$ref": "#/$defs/nonEmptyStringArray"}
      }
    },
    "stage_gates": {
      "type": "array",
      "minItems": 1,
      "items": {
        "type": "object",
        "required": ["gate", "target", "focus"],
        "properties": {
          "gate": {"type": "string", "minLength": 1},
          "target": {"type": "string", "pattern": "^\\d{4}-Q[1-4]$"},
          "focus": {"type": "string", "minLength": 1}
        },
        "additionalProperties": false
      }
    }
  },
  "$defs": {
    "nonEmptyStringArray": {
      "type": "array",
      "minItems": 1,
      "items": {"type": "string", "minLength": 1}
    }
  },
  "additionalProperties": false
}
